序號,案號,國籍,地區,性別,年齡,是否為突破性感染,COVID-19疫苗接種,發病日,症狀,採檢日,確診日,採檢途徑,備註,update_date
1,17847,本國籍,北部,男,20多歲,否,1劑莫德納,1/12,喉嚨痛、頭痛,1/14,1/15,因症採檢,"案17774相關接觸者，已匡列接觸者135人，1人列集中隔離、4人
列居家隔離、130人列自主健康管理。",2022/01/14
2,17880,本國籍,北部,女,10多歲,否,無,1/14,臉紅微熱,1/14,1/15,接觸者採檢,案17774相關接觸者，接觸者匡列中。,2022/01/14
3,17881,本國籍,北部,女,10多歲,是,2劑BNT,X,無症狀,1/14,1/15,接觸者採檢,"案17774相關接觸者，已匡列接觸者2人，列居家隔離，餘匡列
中。",2022/01/14
4,17882,本國籍,北部,女,10多歲,是,2劑BNT,調查中,調查中,1/14,1/15,接觸者採檢,案17774相關接觸者，接觸者匡列中。,2022/01/14
5,17883,本國籍,北部,女,20多歲,是,2劑BNT,X,無症狀,1/14,1/15,接觸者採檢,案17630相關接觸者，接觸者匡列中。,2022/01/14
6,17884,本國籍,北部,男,30多歲,是,2劑AZ,X,無症狀,1/14,1/15,接觸者採檢,案17630相關接觸者，接觸者匡列中。,2022/01/14
